{
  "candidate_set_id": "seat-hold-v0-candidates",
  "gherkin_scenarios": [
    {
      "boundary_conditions": [],
      "candidate_id": "gherkin-r1-hold-available-seat",
      "given": [
        "좌석 상태가 AVAILABLE이다"
      ],
      "kind": "gherkin",
      "name": "AVAILABLE 좌석에 HOLD 요청 시 성공한다",
      "requirement_ids": [
        "R1"
      ],
      "then": [
        "HOLD 요청이 성공한다",
        "좌석 상태가 HELD로 변경된다"
      ],
      "when": [
        "해당 좌석에 HOLD를 요청한다"
      ]
    },
    {
      "boundary_conditions": [],
      "candidate_id": "gherkin-r2-rehold-rejected-while-active",
      "given": [
        "좌석 상태가 HELD이다",
        "좌석의 expiresAt이 설정되어 있다",
        "현재 시각(now)이 expiresAt보다 이전이다"
      ],
      "kind": "gherkin",
      "name": "만료되지 않은 HELD 좌석에 재-HOLD 요청 시 거절한다",
      "requirement_ids": [
        "R2"
      ],
      "then": [
        "재-HOLD 요청이 거절된다",
        "좌석은 기존 HELD 상태와 expiresAt을 유지한다"
      ],
      "when": [
        "해당 좌석에 재-HOLD를 요청한다"
      ]
    },
    {
      "boundary_conditions": [],
      "candidate_id": "gherkin-r3-rehold-allowed-after-expiry",
      "given": [
        "좌석 상태가 HELD이다",
        "좌석의 expiresAt이 설정되어 있다",
        "현재 시각(now)이 expiresAt보다 이후이다"
      ],
      "kind": "gherkin",
      "name": "만료된 HELD 좌석에 재-HOLD 요청 시 허용한다",
      "requirement_ids": [
        "R3"
      ],
      "then": [
        "재-HOLD 요청이 성공한다",
        "좌석 상태가 새로운 HOLD로 HELD가 된다"
      ],
      "when": [
        "해당 좌석에 재-HOLD를 요청한다"
      ]
    },
    {
      "boundary_conditions": [
        {
          "condition": "now == expiresAt",
          "expected": "기존 HOLD를 만료된 것으로 판단하고 재-HOLD를 허용한다"
        }
      ],
      "candidate_id": "gherkin-r4-rehold-allowed-at-exact-expiry",
      "given": [
        "좌석 상태가 HELD이다",
        "좌석의 expiresAt이 설정되어 있다",
        "현재 시각(now)이 expiresAt과 정확히 같다"
      ],
      "kind": "gherkin",
      "name": "now == expiresAt일 때 재-HOLD 요청 시 허용한다",
      "requirement_ids": [
        "R4"
      ],
      "then": [
        "기존 HOLD가 만료된 것으로 판단된다",
        "재-HOLD 요청이 성공한다",
        "좌석 상태가 새로운 HOLD로 HELD가 된다"
      ],
      "when": [
        "해당 좌석에 재-HOLD를 요청한다"
      ]
    }
  ],
  "schema_version": "0.1",
  "unit_tests": [
    {
      "action": "request HOLD on the seat",
      "boundary_conditions": [],
      "candidate_id": "unit-r1-hold-available-seat-succeeds",
      "expected": [
        "HOLD request succeeds",
        "seat state becomes HELD"
      ],
      "kind": "unit",
      "name": "AVAILABLE 좌석에 HOLD 요청 시 성공한다",
      "requirement_ids": [
        "R1"
      ],
      "setup": [
        "seat state is AVAILABLE"
      ]
    },
    {
      "action": "request re-HOLD on the seat",
      "boundary_conditions": [],
      "candidate_id": "unit-r2-rehold-active-held-seat-rejected",
      "expected": [
        "re-HOLD request is rejected",
        "seat state remains HELD with original expiresAt"
      ],
      "kind": "unit",
      "name": "now < expiresAt인 HELD 좌석에 재-HOLD 요청 시 거절한다",
      "requirement_ids": [
        "R2"
      ],
      "setup": [
        "seat state is HELD",
        "seat expiresAt is set",
        "now < expiresAt"
      ]
    },
    {
      "action": "request re-HOLD on the seat",
      "boundary_conditions": [],
      "candidate_id": "unit-r3-rehold-expired-held-seat-allowed",
      "expected": [
        "re-HOLD request succeeds",
        "seat state becomes HELD with new hold"
      ],
      "kind": "unit",
      "name": "만료된 HELD 좌석에 재-HOLD 요청 시 허용한다",
      "requirement_ids": [
        "R3"
      ],
      "setup": [
        "seat state is HELD",
        "seat expiresAt is set",
        "now > expiresAt"
      ]
    },
    {
      "action": "request re-HOLD on the seat",
      "boundary_conditions": [
        {
          "condition": "now == expiresAt",
          "expected": "existing HOLD is treated as expired and re-HOLD is allowed"
        }
      ],
      "candidate_id": "unit-r4-rehold-at-exact-expiry-boundary-allowed",
      "expected": [
        "existing HOLD is treated as expired",
        "re-HOLD request succeeds",
        "seat state becomes HELD with new hold"
      ],
      "kind": "unit",
      "name": "now == expiresAt인 HELD 좌석에 재-HOLD 요청 시 허용한다",
      "requirement_ids": [
        "R4"
      ],
      "setup": [
        "seat state is HELD",
        "seat expiresAt is set",
        "now == expiresAt"
      ]
    }
  ]
}
